{
  "version": "0.1.0-pass29",
  "cadence": {
    "thought_update_seconds": 18,
    "memory_event_cooldown_seconds": 30,
    "max_memories_per_citizen": 12
  },
  "mood_axes": {
    "focus": {
      "min": 0,
      "max": 100,
      "default": 55,
      "display": "Focus"
    },
    "energy": {
      "min": 0,
      "max": 100,
      "default": 72,
      "display": "Energy"
    },
    "trust": {
      "min": 0,
      "max": 100,
      "default": 64,
      "display": "Civic Trust"
    },
    "stress": {
      "min": 0,
      "max": 100,
      "default": 28,
      "display": "Stress"
    },
    "curiosity": {
      "min": 0,
      "max": 100,
      "default": 48,
      "display": "Curiosity"
    }
  },
  "intent_weights": {
    "work": 1.0,
    "social": 0.75,
    "home": 0.72,
    "repair": 0.68,
    "study": 0.64,
    "rest": 0.62,
    "investigate": 0.42
  },
  "archetype_models": {
    "harbor_engineer": {
      "label": "Harbor Engineer",
      "core_needs": [
        "stability",
        "repair_order",
        "tool_access"
      ],
      "strengths": [
        "infrastructure repair",
        "power relay diagnosis",
        "weather response"
      ],
      "weaknesses": [
        "political debate",
        "social improvisation"
      ],
      "preferred_tasks": [
        "repair",
        "inspect_infrastructure",
        "walk_to_work",
        "supply_check"
      ],
      "thought_tags": [
        "harbor",
        "repair",
        "weather",
        "tide_power"
      ],
      "district_bias": {
        "port_fabrication": 1.2,
        "green_wards": 0.7,
        "central_nexus": 0.8
      }
    },
    "archive_curator": {
      "label": "Archive Curator",
      "core_needs": [
        "knowledge_order",
        "privacy",
        "source_integrity"
      ],
      "strengths": [
        "memory sorting",
        "record validation",
        "quiet observation"
      ],
      "weaknesses": [
        "crowds",
        "emergency labor"
      ],
      "preferred_tasks": [
        "catalog_record",
        "research",
        "walk_to_archive",
        "meet_student"
      ],
      "thought_tags": [
        "archives",
        "history",
        "forbidden_fragments",
        "memory"
      ],
      "district_bias": {
        "education_ring": 1.2,
        "central_nexus": 1.05,
        "simulation_belt": 0.9
      }
    },
    "biomedical_technician": {
      "label": "Biomedical Technician",
      "core_needs": [
        "patient_safety",
        "clean_rooms",
        "ethics"
      ],
      "strengths": [
        "diagnosis",
        "calm intervention",
        "nanotech handling"
      ],
      "weaknesses": [
        "public confrontation",
        "rumor control"
      ],
      "preferred_tasks": [
        "clinic_shift",
        "check_patient",
        "sanitize_station",
        "meal_break"
      ],
      "thought_tags": [
        "biomedical",
        "health",
        "nanotech",
        "containment"
      ],
      "district_bias": {
        "biomedical_quarter": 1.35,
        "residential_terraces": 0.9
      }
    },
    "simulation_designer": {
      "label": "Simulation Designer",
      "core_needs": [
        "creative_control",
        "safe_testing",
        "user_feedback"
      ],
      "strengths": [
        "scenario design",
        "rapid prototyping",
        "social imagination"
      ],
      "weaknesses": [
        "routine maintenance",
        "strict hierarchy"
      ],
      "preferred_tasks": [
        "test_simulation",
        "adjust_scenario",
        "meet_player",
        "creative_walk"
      ],
      "thought_tags": [
        "simulation",
        "safeguards",
        "design",
        "escape_routes"
      ],
      "district_bias": {
        "simulation_belt": 1.45,
        "education_ring": 1.0,
        "central_nexus": 0.75
      }
    },
    "civic_mediator": {
      "label": "Civic Mediator",
      "core_needs": [
        "public_trust",
        "conflict_resolution",
        "clear_directives"
      ],
      "strengths": [
        "negotiation",
        "public speaking",
        "social sensing"
      ],
      "weaknesses": [
        "private doubt",
        "technical repair"
      ],
      "preferred_tasks": [
        "forum_session",
        "resolve_argument",
        "walk_to_plaza",
        "status_review"
      ],
      "thought_tags": [
        "policy",
        "trust",
        "citizen_mood",
        "nexus"
      ],
      "district_bias": {
        "central_nexus": 1.4,
        "residential_terraces": 1.05
      }
    },
    "greenward_keeper": {
      "label": "Greenward Keeper",
      "core_needs": [
        "ecological_balance",
        "quiet",
        "public_wellbeing"
      ],
      "strengths": [
        "garden repair",
        "animal care",
        "mood stabilization"
      ],
      "weaknesses": [
        "machine politics",
        "restricted simulations"
      ],
      "preferred_tasks": [
        "tend_garden",
        "walk_pet",
        "check_climate_dome",
        "rest"
      ],
      "thought_tags": [
        "green_wards",
        "wildlife",
        "gardens",
        "mood"
      ],
      "district_bias": {
        "green_wards": 1.5,
        "biomedical_quarter": 0.85,
        "port_fabrication": 0.65
      }
    }
  }
}